Name,Style,ABV,Rating,Hops
Stay Awhile And Listen,DIPA,8,4.07,"Krush, El Dorado BBC, Cascade"
Words To Live By,DIPA,8,4.07,"Citra, Topaz, Mosaic, Vic Secret"
Shimmers,DIPA,8,4.05,"Citra, Sabro, Idaho 7, Motueka"
Wet Zephyr,DIPA,8.5,4.03,"Mosaic, Amarillo"
Return To Sender,DIPA,8,4.03,"Citra, Simcoe, Mandarina"
Time Runs Like Sand Through Your Fingers,DIPA,8,4.02,"Topaz, Mosaic Lupomax, Citra"
Monolith,DIPA,8,4.02,"Citra BBC, Enigma, Mosaic BBC"
Kaleidoscopic Octopus,DIPA,8,4.01,"Mosaic BBC, Citra, Simcoe"
Reason To Give,DIPA,8,4.01,"Idaho 7, Mosaic BBC"
Paragraph,TIPA,10,4.01,"Citra, Vic Secret"
Falling Green,DIPA,8,4.01,"Citra, Mosaic, Cascade"
Hver Gang Jeg Tænker Tilbage På Hovedgaden 84E,DIPA,8,4.01,"Idaho 7, Amarillo, Chinook BBC"
Kinfolk,DIPA,8.4,4.01,"Cashmere Lupomax, Citra Spectrum, Citra BBC"
Hollow Names,DIPA,8,4,"Mosaic BBC, Amarillo BBC"
Where The Sky Meets The Earth,IPA,6,4,"Amarillo, Galaxy, Citra, Ekuanot"
Benevolence,DIPA,8.2,4,"Nugget, Strata, Idaho 7, Mosaic"
Sparrows,DIPA,8,3.99,"Ekuanot, Topaz, Citra"
Phase Shifter,DIPA,8,3.99,"Citra, Azacca, Idaho 7, Galaxy"
Inferno In Paradise,DIPA,8,3.99,"Citra, Amarillo"
Foliage,DIPA,8.2,3.99,"BRU-1 Lupomax, Talus, Mosaic"
Motions In Time,DIPA,8,3.99,"Galaxy, Mosaic Spectrum, Mosaic"
Cohesive Shift,DIPA,8,3.99,"Citra, Mosaic, Amarillo"
Creativity Juice,DIPA,8,3.99,"Strata, Enigma, HBC 638"
Everything In Motion,DIPA,8,3.98,"Motueka, Pacific Sunrise, Nelson Sauvin"
Moonscape,DIPA,7.8,3.98,"Motueka, Sabro, Citra"
Reach,DIPA,8,3.98,"Citra, Simcoe, Mandarina Bavaria"
Wayward,DIPA,8,3.98,"Huell Melon, Citra"
Carry The Light,DIPA,8,3.98,"Citra, Mosaic, Chinook"
Leaping Dawn,DIPA,8,3.97,"Mosaic, Motueka, Nelson, Simcoe"
Live,DIPA,8,3.97,"Citra, Idaho 7, Simcoe"
High & Mighty,DIPA,8,3.97,"Citra BBC, Citra Lupomax, Cashmere"
Playfair,DIPA,8.2,3.97,"Galaxy, Mosaic Spectrum, Mosaic"
Friends In High Places,DIPA,7.8,3.97,"BRU-1 Spectrum, El Dorado BBC, Mosaic, Enigma"
The Paths We Take,DIPA,8,3.96,"Mosaic Lupomax, Azacca Lupomax"
String Interpolation,DIPA,8,3.96,"Chinook BBC, Citra BBC"
Come Fall,IPA,7.1,3.96,"Mosaic, Galaxy, Hallertau Blanc, Centennial"
Big Old Bamse,DIPA,8,3.96,"El Dorado, Citra BBC"
River Kings,DIPA,8,3.96,"Vic Secret, Mosaic, Amarillo"
Emma,DIPA,8.2,3.96,"Citra Lupomax, Rakau, El Dorado"
A Matter Of Perspective,DIPA,7.8,3.95,"Enigma, Strata, Hallertau Blanc"
Show Me Colors,DIPA,7.8,3.95,"Citra, Ella, Galaxy"
What We Leave Behind,DIPA,8.5,3.95,"Cascade, Chinook, Columbus"
Needless To Say,DIPA,7.8,3.95,"Talus, Citra, Eclipse"
Skyrise,DIPA,8.2,3.94,"Rakau, Cashmere, Simcoe"
Shifting Sands,DIPA,7.9,3.94,"Enigma, Strata, Sabro"
Resonance,IPA,6.8,3.94,"Galaxy, Motueka, El Dorado Lupomax"
Oceanside,DIPA,8.2,3.94,"Galaxy, Motueka, Hallertau Blanc"
So Far So Good,DIPA,8,3.94,"Galaxy, Sabro, Azacca Lupomax, Cashmere"
Formations,DIPA,7.8,3.94,"Cascade, Enigma, Strata"
Shed A Tear For The Books I Should Have Read,DIPA,7.8,3.94,"Mosaic, El Dorado, Galaxy"
Progressions,DIPA,8.5,3.93,"Topaz, Galaxy, Amarillo, Citra Lupomax, Sabro"
Monochrome,DIPA,7.8,3.93,"Strata, El Dorado, Sabro"
Desolate Dreams,DIPA,8,3.93,"Enigma, Amarillo, Azacca"
Returning Home,DIPA,8,3.93,"Comet, Comet BBC, Cascade"
Floating Among Clouds,DIPA,8,3.92,"Strata, El Dorado, Idaho 7"
Fireflies,DIPA,8.2,3.92,"Strata, Citra, Mosaic"
Aiden,DIPA,8,3.92,"BRU-1, Mosaic Lupomax, Cashmere Lupomax, Amarillo"
Relentless,IPA,6.8,3.92,"BRU-1 Lupomax, El Dorado Lupomax, Citra, Strata"
Passenger,IPA,6.8,3.92,"Citra, Hallertau Blanc, Nelson"
Strains,DIPA,8,3.91,"Cashmere, Citra BBC, Motueka, Sabro"
Novelist,DIPA,8.5,3.91,"Citra, Chinook"
Citrella,DIPA,8,3.91,"Citra, Ella"
No Worries About What Was,DIPA,8,3.91,"Citra BBC, Mosaic BBC, Columbus"
Virtues,DIPA,8,3.91,"Strata, Enigma, HBC 638"
Full Spectrum,DIPA,8,3.91,"Columbus Lupomax, Mosaic Spectrum, Mosaic Lupomax, El Dorado"
Mirage,DIPA,8.2,3.9,"Nelson Sauvin, Enigma"
April Showers,IPA,6.2,3.9,"Galaxy, Citra BBC"
Polychrome,IPA,6,3.9,"El Dorado BBC, Sabro, Citra"
To Call Each Thing By Its Right Name,DIPA,7.8,3.9,"Chinook BBC, Citra BBC, Ekuanot BBC"
Shine A Light,IPA,6.4,3.9,"Citra Spectrum, Azacca, El Dorado, Enigma"
Echo Echo,DIPA,8,3.9,"Enigma, Citra, Simcoe"
Fray,IPA,6.5,3.9,"Vic Secret, Mosaic, Simcoe"
Transmission,IPA,6.5,3.89,"El Dorado Spectrum, El Dorado Lupomax, El Dorado, Idaho 7"
Eversome,IPA,6.2,3.89,"Citra, Mosaic, Idaho 7, Simcoe"
Love And Be Loved In Return,IPA,6,3.89,"Simcoe, Ekuanot BBC, Mosaic"
Det Er En Af De Ting Jeg Har Lært,DIPA,8,3.89,"Vic Secret, Ella, El Dorado"
Serotonin,IPA,6.2,3.89,"Idaho 7, BRU-1 Lupomax, Pacific Sunrise, Vic Secret"
Dark Patterns,DIPA,8,3.88,"Hallertau Blanc"
Riget Exodus,DIPA,8,3.88,"Citra, Mosaic, Columbus"
From Our Hands We Give,DIPA,8,3.88,"Sabro, Citra BBC"
Waterways,IPA,6,3.88,"Citra, Enigma, Topaz"
Savannah,DIPA,8,3.87,"Enigma, BRU-1, El Dorado BBC"
Light Wave,IPA,7.5,3.87,"Citra, Simcoe, Enigma"
Biota,IPA,6.5,3.87,"Citra, BRU-1 Spectrum, El Dorado Lupomax, Sabro"
Rays of Silence,IPA,6,3.87,"Azacca, Simcoe, Citra BBC"
Vast Collection,IPA,6.2,3.87,"Mosaic, Mosaic BBC"
Whispers Of The Ocean,IPA,6,3.87,"Strata CGX, Citra"
Alpine,DIPA,7.8,3.87,"Idaho 7, El Dorado, Galaxy"
Birds Of A Feather,IPA,6.5,3.86,"Citra, Ella, Eclipse"
Carrousel Carrousel,DIPA,8,3.86,"Amarillo, Simcoe, Vic Secret, Mosaic"
Hope Inside The Fire,IPA,6.2,3.86,"Citra Spectrum, Citra, Citra BBC, Citra Lupomax"
Peaks,IPA,6.2,3.86,"Mosaic, Belma, Sabro, BRU-1"
Lakeside,DIPA,7.8,3.86,"Talus Cryo, Eclipse, Amarillo"
Multitudes,IPA,6,3.86,"Mosaic, Amarillo Lupomax, Chinook BBC"
The Light You Leave On,IPA,6.2,3.86,"Talus, Mosaic, Galaxy"
Evertales,IPA,6,3.86,"Mosaic BBC, Ekuanot BBC, Amarillo BBC"
Ourasi,IPA,6.2,3.85,"Citra, Simcoe, Styrian Cardinal"
In Bloom,IPA,6.2,3.85,"Talus, Enigma, Motueka"
Shadows & Light,IPA,6.2,3.85,"Enigma, Citra BBC, Columbus"
Afterglow,DIPA,8,3.85,"Strata, Azacca, Simcoe"
Pivot - Strata,IPA,6,3.85,"Strata"
Union & Hyde,IPA,6.2,3.85,"Enigma, Topaz"